description Old,description New ,similarity,Title New,Title Old,similarity
"بيع هيكل عظمي كامل لغورغوصور، وهو نوع من الديناصورات ينتمي إلى عائلة ""تي-ريكس"" وعاش قبل أكثر من 77 مليون سنة، بنحو 6.1 ملايين دولار ضمن مزاد تولت تنظيمه دار سوذبيز في نيويورك.","بيع هيكل عظمي كامل لغورغوصور، وهو نوع من الديناصورات ينتمي إلى عائلة ""تي-ريكس"" وعاش قبل أكثر من 77 مليون سنة، بنحو 6.1 ملايين دولار ضمن مزاد تولت تنظيمه دار سوذبيز في نيويورك.",1.0,بيع هيكل ديناصور عاش قبل 77 مليون عام برقم خيالي, بيع هيكل ديناصور عاش قبل 77 مليون عام برقم خيالي ,0.9795918367346939
تبادلت روسيا وأوكرانيا، يوم الجمعة، الاتهامات بشأن هجمات صاروخية أسفرت عن سقوط أسرى ومدنيين.,تبادلت روسيا وأوكرانيا، يوم الجمعة، الاتهامات بشأن هجمات صاروخية أسفرت عن سقوط أسرى ومدنيين.,1.0,"شرق أوكرانيا يشتعل.. مقتل أسرى ومدنيين وحديث عن خطة ""بديلة"""," شرق أوكرانيا يشتعل.. مقتل أسرى ومدنيين وحديث عن خطة ""بديلة"" ",0.9833333333333333
"أفادت صحيفة ""الباييس"" الإسبانية، الجمعة، بأن مدعيا عاما طالب بمعاقبة النجمة الكولومبية شاكيرا بالسجن 8 سنوات، وبدفع غرامة تتجاوز قيمتها 23 مليون يورو (23.51 مليون دولار)، في قضية احتيال ضريبي.","أفادت صحيفة ""الباييس"" الإسبانية، الجمعة، بأن مدعيا عاما طالب بمعاقبة النجمة الكولومبية شاكيرا بالسجن 8 سنوات، وبدفع غرامة تتجاوز قيمتها 23 مليون يورو (23.51 مليون دولار)، في قضية احتيال ضريبي.",1.0,"الأزمات تلاحق شاكير.. غرامة ""مليونية"" وعقوبة بالسجن"," الأزمات تلاحق شاكير.. غرامة ""مليونية"" وعقوبة بالسجن ",0.9807692307692307
يشغل بقايا صاروخ صيني ضخم قد يسقط على الأرض، بال كثيرين حول العالم، وخصوصا مع تضارب الأنباء بشأن موعد وصوله، ومكان سقوطه، والآثار المحتملة لذلك.,يشغل بقايا صاروخ صيني ضخم قد يسقط على الأرض، بال كثيرين حول العالم، وخصوصا مع تضارب الأنباء بشأن موعد وصوله، ومكان سقوطه، والآثار المحتملة لذلك.,1.0,خرائط توضح مكان والموعد المتوقع لسقوط الصاروخ الصيني التائه, خرائط توضح مكان والموعد المتوقع لسقوط الصاروخ الصيني التائه ,0.9833333333333333
قال علماء إن درجات الحرارة الزائدة في جميع أنحاء أوروبا في يوليو الجاري ستعقبها موجة حر طويلة الأمد في مياه البحر المتوسط، مما يمكن أن يدمر النظم البيئية ويقتل أعدادا من الكائنات والأنواع البحرية في الأسابيع المقبلة.,قال علماء إن درجات الحرارة الزائدة في جميع أنحاء أوروبا في يوليو الجاري ستعقبها موجة حر طويلة الأمد في مياه البحر المتوسط، مما يمكن أن يدمر النظم البيئية ويقتل أعدادا من الكائنات والأنواع البحرية في الأسابيع المقبلة.,1.0,الموت في أغسطس.. موجة حر غير مسبوقة في مياه البحر المتوسط, الموت في أغسطس.. موجة حر غير مسبوقة في مياه البحر المتوسط ,0.9827586206896551
افتتح ريشي سوناك وليز تراس، المرشّحان لخلافة رئيس الوزراء البريطاني المستقيل بوريس جونسون، مساء الخميس، الحدث الانتخابي الأول من سلسلة من 12 حدثا انتخابيا في كل أنحاء البلاد لإقناع أعضاء الحزب المحافظ بأدائهما.,افتتح ريشي سوناك وليز تراس، المرشّحان لخلافة رئيس الوزراء البريطاني المستقيل بوريس جونسون، مساء الخميس، الحدث الانتخابي الأول من سلسلة من 12 حدثا انتخابيا في كل أنحاء البلاد لإقناع أعضاء الحزب المحافظ بأدائهما.,1.0,أبرز نقاط الخلاف بين تراس وسوناك بأول مواجهة أمام المحافظين, أبرز نقاط الخلاف بين تراس وسوناك بأول مواجهة أمام المحافظين ,0.9833333333333333
وسط حالة سخط أميركية واسعة من سياسات الحزبين الديمقراطي والجمهوري سيما خلال الدورتين الماضية والحالية من رئاسة البلاد، يعتزم العشرات من مسؤولي الحزبين السابقين الإعلان عن حزب جديد.,وسط حالة سخط أميركية واسعة من سياسات الحزبين الديمقراطي والجمهوري سيما خلال الدورتين الماضية والحالية من رئاسة البلاد، يعتزم العشرات من مسؤولي الحزبين السابقين الإعلان عن حزب جديد.,1.0,"حزب المنشقين.. هل يكون ""إلى الأمام"" بديلا لبايدن وترامب؟"," خاص حزب المنشقين.. هل يكون ""إلى الأمام"" بديلا لبايدن وترامب؟ ",0.9491525423728814
لم يكن سهلا، مساء الخميس الماضي، العثور على ربطة خبز واحدة على جميع الأراضي اللبنانية، ولا الوقوف أمام الأفران التي تحولت إلى ساحات عنف متنقل على غرار ما حصل العام الماضي مثل هذا الوقت أمام محطات الوقود.,لم يكن سهلا، مساء الخميس الماضي، العثور على ربطة خبز واحدة على جميع الأراضي اللبنانية، ولا الوقوف أمام الأفران التي تحولت إلى ساحات عنف متنقل على غرار ما حصل العام الماضي مثل هذا الوقت أمام محطات الوقود.,1.0,"طوابير وإطلاق نار.. أفران لبنان تتحول إلى ""ساحات عنف"""," خاص طوابير وإطلاق نار.. أفران لبنان تتحول إلى ""ساحات عنف"" ",0.9464285714285714
تتعرض مدينة خاركيف، شمال شرق أوكرانيا، إلى وابل من الصواريخ الروسية في مسعى جديد من موسكو لتحقيق انتصار معنوي في بداية المرحلة الثالثة من الحرب بالسيطرة على ثاني أكبر المقاطعات الأوكرانية وأكبر مركز صناعي بالبلاد.,تتعرض مدينة خاركيف، شمال شرق أوكرانيا، إلى وابل من الصواريخ الروسية في مسعى جديد من موسكو لتحقيق انتصار معنوي في بداية المرحلة الثالثة من الحرب بالسيطرة على ثاني أكبر المقاطعات الأوكرانية وأكبر مركز صناعي بالبلاد.,1.0,"""مدينة اللهب"".. هل تكون طريقًا جديدًا لروسيا نحو كييف؟"," خاص ""مدينة اللهب"".. هل تكون طريقًا جديدًا لروسيا نحو كييف؟ ",0.9473684210526315
يثير تشظي الحركات المسلحة وتكاثرها مخاوف كبيرة في السودان كما يلقي ظلالا قاتمة حول إمكانية نجاح جهود الاستقرار في المناطق التي عانت نزاعات أهلية استمرت أكثر من ثلاث عقود.,يثير تشظي الحركات المسلحة وتكاثرها مخاوف كبيرة في السودان كما يلقي ظلالا قاتمة حول إمكانية نجاح جهود الاستقرار في المناطق التي عانت نزاعات أهلية استمرت أكثر من ثلاث عقود.,1.0,تشظت إلى 87.. جدل كبير حول تعدد الحركات المسلحة في السودان, خاص تشظت إلى 87.. جدل كبير حول تعدد الحركات المسلحة في السودان ,0.9508196721311475
قال وزير الخارجية الروسي سيرغي لافروف، يوم الجمعة، إن كييف لا تريد إدارة الحوار والتفاوض فيما يتعلق بالملف الأوكراني.,قال وزير الخارجية الروسي سيرغي لافروف، يوم الجمعة، إن كييف لا تريد إدارة الحوار والتفاوض فيما يتعلق بالملف الأوكراني.,1.0,لافروف: نعلم من يقود أوكرانيا.. وكييف لا تريد إدارة التفاوض, لافروف: نعلم من يقود أوكرانيا.. وكييف لا تريد إدارة التفاوض ,0.9833333333333333
"قالت وزارة الدفاع البريطانية في تقرير استخباراتي، يوم الجمعة، إنه من المحتمل أن تكون مجموعة ""فاغنر"" العسكرية الروسية الخاصة قد تم تكليفها بالمسؤولية عن قطاعات محددة من جبهة القتال في شرق أوكرانيا.","قالت وزارة الدفاع البريطانية في تقرير استخباراتي، يوم الجمعة، إنه من المحتمل أن تكون مجموعة ""فاغنر"" العسكرية الروسية الخاصة قد تم تكليفها بالمسؤولية عن قطاعات محددة من جبهة القتال في شرق أوكرانيا.",1.0,"تقرير استخباراتي عن دور قتالي رئيسي لـ""فاغنر"" في أوكرانيا"," تقرير استخباراتي عن دور قتالي رئيسي لـ""فاغنر"" في أوكرانيا ",0.9827586206896551
أعلن الإطار التنسيقي في العراق، يوم الخميس، تشكيل فريق تفاوضي للتباحث مع جميع القوى السياسية بخصوص تشكيل الحكومة، بينما تمر البلاد بحالة من الانقسام الحاد بين الفرقاء.,أعلن الإطار التنسيقي في العراق، يوم الخميس، تشكيل فريق تفاوضي للتباحث مع جميع القوى السياسية بخصوص تشكيل الحكومة، بينما تمر البلاد بحالة من الانقسام الحاد بين الفرقاء.,1.0,العراق.. الإطار التنسيقي يتخذ خطوة نحو تشكيل الحكومة, العراق.. الإطار التنسيقي يتخذ خطوة نحو تشكيل الحكومة ,0.9811320754716981
تسبب حريق في مبنى بجنوب شرق موسكو بمقتل ما لا يقل عن ثمانية أشخاص ليل الخميس الجمعة.,تسبب حريق في مبنى بجنوب شرق موسكو بمقتل ما لا يقل عن ثمانية أشخاص ليل الخميس الجمعة.,1.0,بالفيديو.. قتلى في حريق بموسكو, بالفيديو.. قتلى في حريق بموسكو ,0.967741935483871
تداول نشطاء على مواقع التواصل الاجتماعي في العراق، يوم الخميس، صورا لرئيس الوزراء السابق، نوري المالكي، وهو يحمل سلاحا ويمشي في الشارع، إثر اقتحام أنصار زعيم التيار الصدري، للمنطقة الخضراء في العاصمة بغداد.,تداول نشطاء على مواقع التواصل الاجتماعي في العراق، يوم الخميس، صورا لرئيس الوزراء السابق، نوري المالكي، وهو يحمل سلاحا ويمشي في الشارع، إثر اقتحام أنصار زعيم التيار الصدري، للمنطقة الخضراء في العاصمة بغداد.,1.0,بعد اقتحام المنطقة الخضراء.. المالكي يحمل سلاحا ويخرج للشارع, بعد اقتحام المنطقة الخضراء.. المالكي يحمل سلاحا ويخرج للشارع ,0.9836065573770492
اتفق قادة الميليشيات في طرابلس ومصراتة والزاوية على وقف التحشيد العسكري والعودة لما كانت عليه الأوضاع قبل الاشتباكات التي شهدها غرب ليبيا الأسبوع الماضي.,اتفق قادة الميليشيات في طرابلس ومصراتة والزاوية على وقف التحشيد العسكري والعودة لما كانت عليه الأوضاع قبل الاشتباكات التي شهدها غرب ليبيا الأسبوع الماضي.,1.0,هدنة مؤقتة.. وقف التحشيد في العاصمة الليبية, خاص هدنة مؤقتة.. وقف التحشيد في العاصمة الليبية ,0.9347826086956522
"وافقت الحكومة الألمانية، الأربعاء، على بيع 100 مدفع هاوتزر ألماني من نوع ""PZH-2000"" إلى أوكرانيا، على وقع رد قاس من روسيا على الصفقة وتقليل من أهميتها.","وافقت الحكومة الألمانية، الأربعاء، على بيع 100 مدفع هاوتزر ألماني من نوع ""PZH-2000"" إلى أوكرانيا، على وقع رد قاس من روسيا على الصفقة وتقليل من أهميتها.",1.0,ألمانيا تبيع أقوى المدافع لأوكرانيا.. ورد قاس من روسيا, ألمانيا تبيع أقوى المدافع لأوكرانيا.. ورد قاس من روسيا ,0.9818181818181818
وجدت دراسة طبية حديثة، أن تناولك للأطعمة المعالجة أو المصنّعة يوميا، يمكن أن تزيد بشكل كبير من خطر الإصابة بالخرف.,وجدت دراسة طبية حديثة، أن تناولك للأطعمة المعالجة أو المصنّعة يوميا، يمكن أن تزيد بشكل كبير من خطر الإصابة بالخرف.,1.0,"تسبب الخرف.. أطعمة ""خطيرة"" تجنبها فورا"," تسبب الخرف.. أطعمة ""خطيرة"" تجنبها فورا ",0.9743589743589743
أعلنت السلطات المحلية التابعة للإدارة الذاتية الكردية، يوم الخميس، العثور على مقبرة جماعية في شمال سوريا تضم عشرات الجثث.,أعلنت السلطات المحلية التابعة للإدارة الذاتية الكردية، يوم الخميس، العثور على مقبرة جماعية في شمال سوريا تضم عشرات الجثث.,1.0,تضم امرأة وطفلين.. العثور على مقبرة جماعية شمالي سوريا, تضم امرأة وطفلين.. العثور على مقبرة جماعية شمالي سوريا ,0.9818181818181818
في تطور نوعي، بدأت الإدارة الأميركية مدفوعة بالنجاحات الأخيرة التي حققتها كييف في صد الهجوم الروسي وتحقيق عمليات مضادة، في توفير أسلحة متقدمة، مثل الطائرات المقاتلة التي قالت في وقت سابق إنها قد تصعد الصراع مع موسكو.,في تطور نوعي، بدأت الإدارة الأميركية مدفوعة بالنجاحات الأخيرة التي حققتها كييف في صد الهجوم الروسي وتحقيق عمليات مضادة، في توفير أسلحة متقدمة، مثل الطائرات المقاتلة التي قالت في وقت سابق إنها قد تصعد الصراع مع موسكو.,1.0,"تزويد أوكرانيا بـ""طائرات نفاثة"".. هل يتغيّر الوضع ميدانيا؟"," خاص تزويد أوكرانيا بـ""طائرات نفاثة"".. هل يتغيّر الوضع ميدانيا؟ ",0.9508196721311475
موقع إخباري متنوع، يغطي الأحداث العربية والدولية بشكل آني وعلى مدار الساعة,شاكيرا في أحدث ظهور,0.1935483870967742,دنيا الوطن,بيكيه يفرض شروطه..وشاكيرا بملابس البحر مع أبنائها,0.2033898305084746
قالت وزارة الدفاع الروسية يوم الخميس، إن قواتها دمرت ستة مستودعات ذخيرة أوكرانية في جمهورية دونيتسك الشعبية المعلنة ذاتيا وفي منطقة ميكولايف.,قالت وزارة الدفاع الروسية يوم الخميس، إن قواتها دمرت ستة مستودعات ذخيرة أوكرانية في جمهورية دونيتسك الشعبية المعلنة ذاتيا وفي منطقة ميكولايف.,1.0,روسيا تدمر مستودعات ذخيرة وطائرات درون ومراكز قيادة أوكرانية, روسيا تدمر مستودعات ذخيرة وطائرات درون ومراكز قيادة أوكرانية ,0.9836065573770492
