description Old,description New ,similarity,Title New,Title Old,similarity
"أفاد مراسل ""سكاي نيوز عربية""، اليوم السبت، بدخول حشود من المتظاهرين البوابة الرئيسية للمنطقة الخضراء شديدة التحصين وسط العاصمة العراقية بغداد.","أفاد مراسل ""سكاي نيوز عربية""، اليوم السبت، بدخول حشود من المتظاهرين البوابة الرئيسية للمنطقة الخضراء شديدة التحصين وسط العاصمة العراقية بغداد.",1.0,فيديو.. لحظة اقتحام البوابة الرئيسية للمنطقة الخضراء ببغداد, فيديو.. لحظة اقتحام البوابة الرئيسية للمنطقة الخضراء ببغداد ,0.9833333333333333
حملت وزارة الدفاع الروسية، اليوم السبت واشنطن وكييف مسؤولية مقتل وإصابة 193 أسيرا من أسرى الحرب الأوكرانيين، في إشارة للضربة الصاروخية التي استهدفت مركز الاحتجاز في يلينوفكا.,حملت وزارة الدفاع الروسية، اليوم السبت واشنطن وكييف مسؤولية مقتل وإصابة 193 أسيرا من أسرى الحرب الأوكرانيين، في إشارة للضربة الصاروخية التي استهدفت مركز الاحتجاز في يلينوفكا.,1.0,"الدفاع الروسية تحمل واشنطن وكييف مسؤولية ""مذبحة يلينوفكا"""," الدفاع الروسية تحمل واشنطن وكييف مسؤولية ""مذبحة يلينوفكا"" ",0.9827586206896551
"بيع هيكل عظمي كامل لغورغوصور، وهو نوع من الديناصورات ينتمي إلى عائلة ""تي-ريكس"" وعاش قبل أكثر من 77 مليون سنة، بنحو 6.1 ملايين دولار ضمن مزاد تولت تنظيمه دار سوذبيز في نيويورك.","بيع هيكل عظمي كامل لغورغوصور، وهو نوع من الديناصورات ينتمي إلى عائلة ""تي-ريكس"" وعاش قبل أكثر من 77 مليون سنة، بنحو 6.1 ملايين دولار ضمن مزاد تولت تنظيمه دار سوذبيز في نيويورك.",1.0,بيع هيكل ديناصور عاش قبل 77 مليون عام برقم خيالي, بيع هيكل ديناصور عاش قبل 77 مليون عام برقم خيالي ,0.9795918367346939
تشهد الحدود الصومالية الإثيوبية، توترا شديدا مع إعلان المسؤولين الإثيوبيين في إقليم أوغادين عن تأسيس منطقة عازلة داخل الصومال، لتحجيم نشاط حركة الشباب الإرهابية؛ وهو ما اعتبره صوماليون يشكل خرقا لسيادة البلاد.,تشهد الحدود الصومالية الإثيوبية، توترا شديدا مع إعلان المسؤولين الإثيوبيين في إقليم أوغادين عن تأسيس منطقة عازلة داخل الصومال، لتحجيم نشاط حركة الشباب الإرهابية؛ وهو ما اعتبره صوماليون يشكل خرقا لسيادة البلاد.,1.0,هجوم أوغادين.. نيران تهب على إثيوبيا من داخل الصومال, هجوم أوغادين.. نيران تهب على إثيوبيا من داخل الصومال ,0.9811320754716981
متابعة مستمرة,متابعة مستمرة,1.0,أنصار التيار الصدري يعلنون الاعتصام المفتوح داخل البرلمان العراقي، ورئيس البرلمان يعلق عقد جلسات المجلس حتى إشعار آخر - BBC Arabic,أنصار التيار الصدري يعلنون الاعتصام المفتوح داخل البرلمان العراقي، ورئيس البرلمان يعلق عقد جلسات المجلس حتى إشعار آخر,0.9473684210526315
خلّف العثور على جثة طبيبة حالة من الصدمة في النمسا، خاصة أنها كانت تلقت تهديدات بالقتل إثر دفاعها عن تلقي اللقاح المضاد لفيروس كورونا، وعجزها عن توفير  الأمن لنفسها.,خلّف العثور على جثة طبيبة حالة من الصدمة في النمسا، خاصة أنها كانت تلقت تهديدات بالقتل إثر دفاعها عن تلقي اللقاح المضاد لفيروس كورونا، وعجزها عن توفير الأمن لنفسها.,0.9969604863221885,صدمة في دولة أوروبية.. مقتل طبيبة دافعت عن لقاحات كورونا, صدمة في دولة أوروبية.. مقتل طبيبة دافعت عن لقاحات كورونا ,0.9824561403508771
متابعة مستمرة,متابعة مستمرة,1.0,الولايات المتحدة تجري أول اتصال مع روسيا منذ بدء الحرب في أوكرانيا، وتحول جديد في موقف جماعة الإخوان في مصر - BBC Arabic,الولايات المتحدة تجري أول اتصال مع روسيا منذ بدء الحرب في أوكرانيا، وتحول جديد في موقف جماعة الإخوان في مصر,0.9427312775330396
"أفادت صحيفة ""الباييس"" الإسبانية، الجمعة، بأن مدعيا عاما طالب بمعاقبة النجمة الكولومبية شاكيرا بالسجن 8 سنوات، وبدفع غرامة تتجاوز قيمتها 23 مليون يورو (23.51 مليون دولار)، في قضية احتيال ضريبي.","أفادت صحيفة ""الباييس"" الإسبانية، الجمعة، بأن مدعيا عاما طالب بمعاقبة النجمة الكولومبية شاكيرا بالسجن 8 سنوات، وبدفع غرامة تتجاوز قيمتها 23 مليون يورو (23.51 مليون دولار)، في قضية احتيال ضريبي.",1.0,"الأزمات تلاحق شاكير.. غرامة ""مليونية"" وعقوبة بالسجن"," الأزمات تلاحق شاكير.. غرامة ""مليونية"" وعقوبة بالسجن ",0.9807692307692307
قال علماء إن درجات الحرارة الزائدة في جميع أنحاء أوروبا في يوليو الجاري ستعقبها موجة حر طويلة الأمد في مياه البحر المتوسط، مما يمكن أن يدمر النظم البيئية ويقتل أعدادا من الكائنات والأنواع البحرية في الأسابيع المقبلة.,قال علماء إن درجات الحرارة الزائدة في جميع أنحاء أوروبا في يوليو الجاري ستعقبها موجة حر طويلة الأمد في مياه البحر المتوسط، مما يمكن أن يدمر النظم البيئية ويقتل أعدادا من الكائنات والأنواع البحرية في الأسابيع المقبلة.,1.0,الموت في أغسطس.. موجة حر غير مسبوقة في مياه البحر المتوسط, الموت في أغسطس.. موجة حر غير مسبوقة في مياه البحر المتوسط ,0.9827586206896551
دعا الرئيس‭‭ ‬‬البرازيلي السابق لويس إيناسيو لولا دا سيلفا مؤيديه إلى الخروج إلى الشوارع لمساعدته في الفوز بالانتخابات التي ستقام في أكتوبر المقبل في البرازيل وحرمان الرئيس الحالي جايير بولسونارو المنتمي لليمين المتطرف من الفوز بولاية ثانية.,دعا الرئيس‭‭ ‬‬البرازيلي السابق لويس إيناسيو لولا دا سيلفا مؤيديه إلى الخروج إلى الشوارع لمساعدته في الفوز بالانتخابات التي ستقام في أكتوبر المقبل في البرازيل وحرمان الرئيس الحالي جايير بولسونارو المنتمي لليمين المتطرف من الفوز بولاية ثانية.,1.0,لولا يدعو أنصاره للخروج للشوارع لمساعدته بالفوز بالانتخابات, لولا يدعو أنصاره للخروج للشوارع لمساعدته بالفوز بالانتخابات ,0.9833333333333333
انفجرت قنبلة يدوية، الجمعة، خلال مباراة كريكيت في كابول، ما أسفر عن مقتل 19 مشجعا على الأقل، بحسب الأمين العام للأمم المتحدة أنطونيو غوتيريش.,انفجرت قنبلة يدوية، الجمعة، خلال مباراة كريكيت في كابول، ما أسفر عن مقتل 19 مشجعا على الأقل، بحسب الأمين العام للأمم المتحدة أنطونيو غوتيريش.,1.0,"أفغانستان.. غوتيريش يكشف عدد ضحايا ""صادم"" في مباراة الكريكت"," أفغانستان.. غوتيريش يكشف عدد ضحايا ""صادم"" في مباراة الكريكت ",0.9833333333333333
"انخفضت شحنات الغاز الروسي إلى أوروبا عبر خط أنابيب ""نورد ستريم"" بنسبة 20 في المئة تقريبًا يوم الأربعاء الماضي مما يعزز خطر حدوث نقص خلال فصل الشتاء المقبل في العديد من الدول الأوروبية.","انخفضت شحنات الغاز الروسي إلى أوروبا عبر خط أنابيب ""نورد ستريم"" بنسبة 20 في المئة تقريبًا يوم الأربعاء الماضي مما يعزز خطر حدوث نقص خلال فصل الشتاء المقبل في العديد من الدول الأوروبية.",1.0,أوروبا.. شتاء قارس وفاتورة غاز باهظة, خاص أوروبا.. شتاء قارس وفاتورة غاز باهظة ,0.9230769230769231
تتعرض مدينة خاركيف، شمال شرق أوكرانيا، إلى وابل من الصواريخ الروسية في مسعى جديد من موسكو لتحقيق انتصار معنوي في بداية المرحلة الثالثة من الحرب بالسيطرة على ثاني أكبر المقاطعات الأوكرانية وأكبر مركز صناعي بالبلاد.,تتعرض مدينة خاركيف، شمال شرق أوكرانيا، إلى وابل من الصواريخ الروسية في مسعى جديد من موسكو لتحقيق انتصار معنوي في بداية المرحلة الثالثة من الحرب بالسيطرة على ثاني أكبر المقاطعات الأوكرانية وأكبر مركز صناعي بالبلاد.,1.0,"""مدينة اللهب"".. هل تكون طريقًا جديدًا لروسيا نحو كييف؟"," خاص ""مدينة اللهب"".. هل تكون طريقًا جديدًا لروسيا نحو كييف؟ ",0.9473684210526315
"أشعلت قاذفة الصواريخ الأميركية ""هيمارس""، الحرب في أوكرانيا وأثارت جدلًا كبيرًا حول إمكانية إسقاطها من عدمه، لكن تقارير غربية كشفت عن أن هناك 5 أسلحة قادرة على القضاء على المنظومة الأميركية بسهولة؛ بينها سلاحان بيد دول صديقة لموسكو.","أشعلت قاذفة الصواريخ الأميركية ""هيمارس""، الحرب في أوكرانيا وأثارت جدلًا كبيرًا حول إمكانية إسقاطها من عدمه، لكن تقارير غربية كشفت عن أن هناك 5 أسلحة قادرة على القضاء على المنظومة الأميركية بسهولة؛ بينها سلاحان بيد دول صديقة لموسكو.",1.0,"حرب أوكرانيا.. 5 صواريخ تستطيع قهر ""هيمارس"" الأميركية"," حرب أوكرانيا.. 5 صواريخ تستطيع قهر ""هيمارس"" الأميركية ",0.9814814814814815
"تفتتح الجزائر، السبت، رسميا منجم الحديد الكبير بغار جبيلات بمحافظة تندوف، أقصى جنوب غرب الجزائر، وذلك لأول مرة منذ اكتشافه عام 1952، وهو المنجم الذي يوصف بـ ""عملاق المناجم النائم"".","تفتتح الجزائر، السبت، رسميا منجم الحديد الكبير بغار جبيلات بمحافظة تندوف، أقصى جنوب غرب الجزائر، وذلك لأول مرة منذ اكتشافه عام 1952، وهو المنجم الذي يوصف بـ ""عملاق المناجم النائم"".",1.0,"كيف سيغير ""عملاق الحديد النائم"" مكانة الجزائر الاقتصادية؟"," خاص كيف سيغير ""عملاق الحديد النائم"" مكانة الجزائر الاقتصادية؟ ",0.95
لم يمض وقت طويل على التحذير الذي أطلقه وزير الخارجية الروسي، سيرغي لافروف، حول إمكانية اتساع المعارك لتصل إلى أوكرانيا بالكامل، حتى أعلنت وزارة الدفاع الروسية أن قواتها دمرت 6 مستودعات ذخيرة أوكرانية في دونيتسك وبمنطقة ميكولايف، واستهداف قاعدة عسكرية قرب كييف، ما أدّى إلى تدميرها جزئيا.,لم يمض وقت طويل على التحذير الذي أطلقه وزير الخارجية الروسي، سيرغي لافروف، حول إمكانية اتساع المعارك لتصل إلى أوكرانيا بالكامل، حتى أعلنت وزارة الدفاع الروسية أن قواتها دمرت 6 مستودعات ذخيرة أوكرانية في دونيتسك وبمنطقة ميكولايف، واستهداف قاعدة عسكرية قرب كييف، ما أدّى إلى تدميرها جزئيا.,1.0,موسكو تطلق التحذير الأخير.. هل ورّط السلاح الغربي زيلينسكي؟, خاص موسكو تطلق التحذير الأخير.. هل ورّط السلاح الغربي زيلينسكي؟ ,0.9516129032258065
أعلنت وزارة الدفاع الروسية، اليوم السبت، مقتل نحو 250 من القوميين المتطرفين الأوكرانيين خلال عمليات للقوات الروسية في أنحاء متفرقة من إقليم دونباس وأوكرانيا خلال آخر 24 ساعة.,أعلنت وزارة الدفاع الروسية، اليوم السبت، مقتل نحو 250 من القوميين المتطرفين الأوكرانيين خلال عمليات للقوات الروسية في أنحاء متفرقة من إقليم دونباس وأوكرانيا خلال آخر 24 ساعة.,1.0,روسيا: تدمير قطار عسكري ومقتل مئات الجنود الأوكرانيين, روسيا: تدمير قطار عسكري ومقتل مئات الجنود الأوكرانيين ,0.9814814814814815
"بعد إنتاج الأسلحة الخفيفة من المسدسات والرشاشات خلال الأشهر الماضية، كشفت هيئة التصنيع الحربي العراقية، عن ""مدفع التحدي""، كأول سلاح ثقيل، يُنتج محلياً، وسط دعوات لتعزيز هذا التطور، وعقد شراكات مع مؤسسات مختصة بصناعة السلاح، فضلاً عن شراكات مع الدول العربية.","بعد إنتاج الأسلحة الخفيفة من المسدسات والرشاشات خلال الأشهر الماضية، كشفت هيئة التصنيع الحربي العراقية، عن ""مدفع التحدي""، كأول سلاح ثقيل، يُنتج محلياً، وسط دعوات لتعزيز هذا التطور، وعقد شراكات مع مؤسسات مختصة بصناعة السلاح، فضلاً عن شراكات مع الدول العربية.",1.0,"""مدفع التحدي"".. تعرف على أول سلاح عراقي ثقيل"," ""مدفع التحدي"".. تعرف على أول سلاح عراقي ثقيل ",0.9777777777777777
